id,human_readable_id,community,level,parent,children,title,entity_ids,relationship_ids,text_unit_ids,period,size
bc3028da-5530-4fe7-b2af-baf4e75ec327,0,0,0,-1,"[37, 38, 39, 40, 41, 42]",Community 0,"[79ad9f19-d3ff-4378-b33e-5a6aa023a758, c5f73c82-f025-4e7f-b498-96dd95595b67, 9a068f6f-f022-48a8-a9b6-ca27444d06ef, 33c47fff-1b90-476d-830a-ca0a093f23cc, b8ecf5f7-b4f4-445d-8442-0e6d8a33a158, 9894b324-2f68-469a-aaac-6da0ba974ebb, 475ce2ae-4d05-47db-94c9-e1c7c044745c, e0d2c0d6-bceb-4a0a-8877-393601490c11, 0dc2fe8d-98e7-4cf9-9637-815a0be15cbe, 6dce74e6-3fed-4475-8689-e8f6490d691c, 88c7cffd-a43d-488f-b41b-1e6a97407262, 590914fd-7137-43fe-abe3-57d266c4e7bb, 08cfef14-99ee-4926-a08c-ad14781e7b8a, 8f32514e-e0ef-4c57-a17f-830c92dc835e, 39118089-460f-4bca-b16a-d08c746d5c3f, 15070e4a-0e95-4ef6-bd06-a9d62a6ec01e, 6354f416-af02-4f3b-ad16-52163b099cb4, 797d17f1-e660-424c-9a94-0ed30cf04a43, 19133ae7-2815-448f-805e-c6c823b4a0c4, 58904544-1599-4d76-95a6-51751036ebf1, 5b756ba8-d43f-47de-ace4-5374b1241cbe, a686489b-cae2-44b8-85cd-2d0e32296724, 7701b0c7-f7b7-4ac6-bec5-496fdd6c2baf, ada4c192-034b-4e82-b101-b0972d14c2a5, 3e540e3f-9cd6-44c1-99c7-c118f36258a9, c24cd7e8-f5fa-40aa-90ea-c90d8fb00fc9, 4147393a-6042-490d-8eab-84263ec6511b, d1200d86-597a-4e33-830c-33f02a70d3d9, 0b942ced-0819-427c-9c30-4a4d078eefba, 451ca748-c070-4674-a950-2e6a9fa62c57, 85f3c3cb-86c7-4c1e-923c-37161bbf312a, 4d491adb-ceb1-45c1-b281-9769247271fa, 7126237c-b838-41d0-aac0-5359340dfb81, 780db007-f9c3-43d9-9998-d3cc404614d0, 16328e31-489e-4f37-bd2f-41a3a604bafe, 11414ccc-692f-409c-9a5f-1f36d8c1724c, 07342d85-49f3-4c3c-8bcb-c9a7d36e5d72, ad742184-2fb8-437f-b90f-e3daf3b37784, 64eb9792-2be1-415b-adb7-73d632589a8b, 027e9ba8-2ee3-4772-b06f-fdd626845218, 028a335c-32a1-4313-804a-214772ec6477, 3a4f7a4f-0f09-4ef1-a294-4fbeace31780]","[046fa65f-fafa-46ca-a58f-aaca5253e6bb, 0722f937-2977-46a0-9b67-6b1e8fe96056, 10ed814f-6735-4687-85ba-77e684c51d78, 118b0c52-d76d-4821-be5a-02693735d32e, 12b1adbc-61cb-4c12-8edf-f8e292eaff3a, 1407093e-4148-4e77-874c-570dc862ea0b, 1463e9cf-c14a-4de1-84ec-0cdaf39f4088, 23b05d11-b052-4a4b-8d17-273cdb85ac3a, 240d1115-355b-416e-935c-1e0b60cd6942, 29398813-f0ef-44a0-8318-c130965c5b94, 2ba856e6-dd25-4ab5-9c26-2ddd98343dee, 34eed28f-021b-421d-bddd-149ec8b09e7e, 3cdba70f-18fa-4d25-a35e-56d6c3398429, 3d05b9f0-668f-49f3-9c6a-1aaff6bccd25, 3f78a3c9-20f8-43fc-a3fc-b485d0a7130a, 45963481-af18-4e28-a826-d303e6c43655, 4f087ad3-2b48-43bb-9728-0c4c52673b2f, 4f0c3ace-b7c1-4b91-9b90-fff4d4698b10, 505bc6b0-975e-4839-91a8-daf11182a904, 52646eae-3bdb-44ac-af7f-9283167bac55, 601b14b4-f1ef-4970-a50a-99b912ec447c, 60649094-1fcf-4567-b2cf-3efd2dfab9f2, 65f1b2c1-450f-4fe0-9da7-4d0b5dccd0f5, 6a997d1a-1a43-4198-be57-9dc5a8986e66, 72c61b78-a7ad-4deb-869d-f38ad659ab57, 7bb17033-93b5-4e1d-b44d-1afd07cae120, 7eaca6e8-e423-4759-9bf1-235821c9bf6c, 807c9b6c-9599-461f-ba1b-aa1dacc56474, 80b65df8-358b-407d-aa3e-d5d8b2fa1d3c, 80b8f20c-769b-4f2e-84c9-13f4fa0f93de, 89651451-00bd-4c1d-a8e5-652ec7f3d9dd, 9b64b4f2-15bc-40dc-b314-27336eb4f22a, aaeb86e8-e8e0-4746-a91f-e3e22958a530, ac044c0c-68d8-4502-b301-ad4123e95015, adcdc57a-c312-42b3-b736-dd2dcaaa112e, b0ec9686-9323-486e-819f-c542886b1310, bb0db019-a667-4a20-bd74-c09e2ff88bd8, be067306-6d75-463f-80fb-9cab421c4c18, be900779-87a1-476b-8531-d345b0a2515e, c9621fd6-0bc1-4f38-a578-8da4cf424a8e, ca62d4db-c9a5-4d13-8f03-7b7c2c0f2575, d170160e-556e-4934-aa3c-61c7f7d59f89, d1b0c004-0975-4638-bdd4-ca0db9ec6e2e, d2a0405b-1c02-43ae-9b6c-713c0ffb0645, d5221d91-9ba1-4c26-9aa3-49151f519f49, d83b51c4-81bd-479e-aa5a-51fb0bd0b428, e47460db-15d8-46b8-a1e4-5f9d0eab8ced, ed0f6cee-f58a-43e9-8d37-39d4b09e5388, f60024e0-2204-458e-9154-7f391b21e422, fe552811-23a7-4ca3-82a9-043f34aa2629, fe5c266b-fe49-40a1-84bc-631efd270caf]","[54644348c994c4c8e84c5f4568635e20303bbdff1e40ebc898372ba64d4a6fc1163a7e1345abc6fa5019096137d3102845e2720b2ff08b548ddf36a3be3549b2, 645f6cf664742f5bcd970e02d3c1121f06c5045b5d70fba15fb40a12bbb93e305054797981f5540bee02177116af94403c668c3c4c20dd002d5e1b19e5a5ab71, bb50f2d8d94014c4ad08f252cd63b0e06151fb15038753fbf044af337142d4dfe823a29ebc521228eb79904777c0df27581c47282bc453347d23f4d8844f96a8, bd8754801f2bc35a58d63d299711d04cb623ac8ccfd7de43602ef8fca60056b7cee06f8f03f582c86240ec81eb0a4eb533d36092b5e757169daebeebbae0d38b]",2025-10-10,42
b3ab8262-29c3-4fb8-a794-49ed7d1a7c00,1,1,0,-1,"[43, 44, 45, 46, 47]",Community 1,"[ff37f0cc-ac7b-4835-bf7d-295c32b606a4, 76c866e3-4f81-4c29-938e-a9969ab187bc, f6d7125d-7378-4f16-857e-e3634bfb4e4a, ddd1b18e-8ccb-4815-968a-e9e8cb7821a2, 80bf9c4a-e16f-4e9f-a755-5c94b8c9f2c3, 575043c1-31bf-4b66-9f85-8c3eb5bb26b5, de8d34ec-9343-4d2a-a17b-d7655924466c, 51a9ac77-f510-4921-853a-c687d23fa3fc, 9e1d8e70-6cc6-4b94-9cb2-e352c864dfc9, d5055e05-ce78-4327-8e5b-66d452755913, a0b15ca0-64d6-4a74-81fd-2955debad367, 98d48820-37e2-4f12-ba0e-5bb389ff14f9, 89b5e04e-dbea-4064-91df-88cd20a19d17, 12e70e39-c4aa-4532-8778-c511d9737928, c5013894-22b4-46f7-828a-56a7a7ed690d, 155fbd92-271f-45e8-a369-cf1231ed7d47, ebfd9c81-c814-4e47-b550-c44210e8d630, 05f0df1f-f160-406b-94f9-b35b7f8d3a6a, c123cfd7-5d29-4788-9f89-485557cd2b89, d83f6e9c-1dae-4a71-81b6-6134dd2f645a, 12af165d-619e-418d-b3b2-40a152b885f1, 253e8cd6-b02b-4c29-b4ab-8f6772082057, 5866db4f-35c9-442d-a8a3-bdbc799791d5, 07d1644b-c457-437d-8740-b6bcd8349277, fbe16bc6-2dd0-43d7-9d54-26b58265d5c8, 9910800e-d40b-49f2-b854-edf15ec1b3f8, 4815fb3b-b841-4c96-ab26-2110a63c9642, a6151984-d3f9-413e-9127-1f7a3fe33d1e, 71e5f5fe-b6ce-40f4-b75e-2d69d2f14e0b]","[0bb41d42-1291-4e85-ad00-f4541e6bd0bf, 1ae0f4e2-7e5b-4719-a1da-5cbf5cf73ca2, 20f247b1-a2bf-4c77-87c8-728caa7cefdb, 35ef787b-93d6-46ef-bca2-9d060fcfe3fd, 3c9fbf6d-cf87-4e87-8f27-b2d4fcbad40d, 4f70ca7e-ea60-4a94-8fe3-8a984d535bfd, 5adba477-f10c-48a6-8f0e-f7bc591cc797, 5ce5d03b-9d7b-4d1d-9263-cc16c387d7ee, 65b481ef-7fa4-43b3-a8da-b344c1cfcd55, 671c1772-5fb1-4dfd-9cb2-2b72d1922c88, 6fc944bb-0462-4d8b-a63c-88c538b68b38, 79240a43-14c7-429e-b37d-ca43f81519c2, 7b6d9fc9-06f5-4024-b4bf-11524279fb9c, 7f8ac956-bf62-4f23-9782-9db90c2d0d01, 8444e89b-a499-442d-a7f3-b1edd3c82a36, 8b63c4a2-f0c3-4151-a5b8-95c04301bfe3, 90556029-f804-497d-8382-8f1cee03fd54, 948fdd44-c0a9-4fe0-bc1e-6b2cc7ff3079, 96b7c119-4b70-4993-8664-7a11dc15b2d0, 9d497ab6-e93d-40e1-8868-7727f61d995d, a033e6ed-4c4d-43c8-ad17-e6b0e7820c16, abb87a1d-9e28-499c-866b-7acfd756c325, abc0eb37-e31e-4404-993c-35174a7a045e, b78336d3-36f7-4555-8ba2-15d6651d4361, b9661e2e-d5fe-4629-bf38-aadb14b6d033, c2eaec0c-2b29-4543-aaf3-3f337a747dc7, c9df4ebb-50fa-4bb2-a7c5-046b8918b435, cc351be8-f3a7-4372-bac7-59e46d4509b0, cf947592-71c5-4eeb-99f5-22c8dff09899, cfcf1f56-dd0d-431e-aafc-bbd5da698eee, ec91394b-3171-4a1a-8878-79a5209af8a6, ee91c1b0-3606-4fb8-bd0a-a58466f835b7]","[b70e3c4d4e9de5eb771f239289c9f47ba9dfdad76ee886c1034b5ca34ff35a06819f9a6069a7ce41b8d96b8a22cb9ae024b5f69f457cd4f0fe2b2adb76cf6428, d35b60bda7fd2be7a11e9b2cf72cdcb2d4966f0d834368f4b546e000179bacac2e86a74c2b7df410f67033f4ad91c278c3288246a4b8555d59a15f9db4dbfed3, d6abbf6d01bca3b62ea46892694dd2d5f49b6d196350b6b2d55609204ea4c7ee89199abfe9181e065b1a8c6bc45688aad159ed83ff8e623895e4e45b207bf6c5, f24f3b8208a579a858eaff296ac67d70145e49bacbfc591e574729292835b9377d95b39104494619d39532d03d8ec10952de30c940dd44e4269b4b96f94104a5]",2025-10-10,29
65f5bbd6-427a-4361-8b60-3def18e13a1d,2,2,0,-1,"[48, 49, 50, 51, 52, 53, 54]",Community 2,"[4ad301de-6faa-44b7-bf86-dcfb8a5bcbe9, b07f334b-257e-4df2-af2e-f99715d4d09b, ee0eee57-a692-4fb6-bd3d-70b072603755, 039b7ac5-082f-4fb5-a5b6-782d28f26a30, d4a451aa-a037-4557-b91c-b0e542ae82b4, 4160a4b5-684b-4c05-b6d4-5f44a5f34699, 284e3833-68fb-4781-9926-e9893cccb115, 1d59499f-2cc1-4297-9d4d-89068a3fb0ae, 1f376490-26e6-4835-9023-45ac2ec13b3a, 1af19336-408c-498b-8989-500eb1a27beb, a6357d07-6cb3-4807-9dfc-99a3048b1b4c, 06d7a0a5-1942-4f30-87e9-889714587c96, edbc4546-1762-4104-9e31-86adc1529676, 0499b142-b483-485b-ba1f-ac62757542e0, f35f5b37-c7de-4579-9e39-a1b741b5c7e5, 7ce1845c-c4db-457c-a661-86008c9e670e, a76280c2-31c9-48b6-b117-9ceed9396b78, 3259f35b-e53d-4194-a3fd-158c04ddae8b, 6eac0428-24e7-4064-a40a-c4a27677cd2a, 60517177-c5a3-4dc1-b6a1-dc55747ba3ca, 6fe7302d-6dda-4967-811b-5024d5393902, f534e345-c2b8-4850-a195-28bf5a5eace3, 3721046e-bbc5-4387-aac1-0027dcdc0e9b, 10702f79-fb9b-41ea-a5a0-7ee793114475, 645eb377-02d4-48f4-9d36-9ab59a662f1d, d08d0f23-6782-4e2d-8bce-dfadaa8e1208, b53d400a-2afa-406c-8957-af9b29de1f91, ca434042-5982-416f-bff1-078e45166b87, 38534927-401e-4321-8982-31183588054c, 81297494-0691-45eb-a335-831884b9274c, dd2baeb5-0c5f-4a7f-aa7d-06624d84b1ef, b56cdd8f-c00b-48e2-b5c5-5da90de802a9, 501c0190-de76-47ed-bfb8-30c9c9059181, 9bc9e517-2e0e-4074-9c43-567b0457fe9f, 7f50ee0e-572b-4a13-b9de-081dad827a99, 86a886ca-14c0-465d-8665-78123f0f8f28, d4fa8799-92ff-4d66-b0b3-8aaf6aa46d4e, 5cae903c-b69b-41ab-8236-d559aaa44fd0, e87f5487-a27e-4dde-9e6d-01a9c85ec784, 5620fc9a-e419-4509-aaa5-6a8ec2acda1f, f878300e-431a-4cd4-a295-e283ea133e6c, 90cabbcb-0409-490b-a742-62e22ad7b4ce, aea9c085-d4c6-4f7c-a0fd-a169beeaff22, 6e0be543-5416-451f-a6f1-e4e5f0157266, 0c88ad64-928e-415c-9cc3-1bd396118c19, bfc4cdae-027a-4803-8f26-02cce67aede1, 4d52b5bd-4037-4b2c-975f-62645d63ea55, 6a8ce3e6-bc1e-40c0-a76d-9d315a00cbfc, 37cc238a-c837-4a76-8a60-01a9f347aae4, 42c8fb33-8096-46a7-8d99-f11730c11720, e86e450b-6bfe-4f27-adad-e0156c85dab9, ae13e52e-7ad2-43cb-a614-ceb1571e347c]","[032845ed-3b6a-49b5-9e20-36988f349a64, 04bdff77-e8ab-4e64-b1b1-65d499606d2a, 0d305035-8762-4993-bace-a91818e9c43c, 12c9e0e8-4756-4370-addf-9d86f3e8b883, 1542578f-9d1f-41e4-82fe-a8c2eee828ec, 16aa206b-b14e-4402-aa9a-b1b97e79b2e0, 1aaa4c56-64a6-43c9-976a-c9de69570060, 21e75112-1420-4798-9949-b58d7778f123, 2614404f-c501-4ee1-a5e1-5bb0f313e669, 26e376f5-0e9d-4f81-8ef7-41b2f42e597d, 2ce98995-4504-4e61-8e58-e478e0440b17, 324ba806-04a1-4cd8-bc1f-c725499d1e3c, 36a81e8b-e92b-4334-9051-0d04ff77b8de, 39fa480f-dc6d-4c5f-8d22-33b1d914c3a7, 40c06e7a-27fc-4729-8b82-02271ac1b825, 4b6646b9-c6ad-4833-ba78-b997733582fd, 4cbd5536-13ad-4816-a35e-f145a5d4bf1d, 4dbd02e7-729d-463a-bee8-5a7a5f991ee7, 4ee4ec16-e86e-43b6-ac90-09b873fd4666, 528223ff-07ee-414e-a393-cb51ac2a677e, 52b3ed50-e4c0-47c7-8999-d3bd4bfa6826, 559961ca-2862-4ac0-8e33-7ad161d970f7, 5e1191f0-2b56-48f7-a627-3e6b3a6de78b, 5f6bc83b-7de8-4eff-ac72-d02116f9f236, 5f6e6b9d-3327-4084-9dfb-d47b106d29fe, 6512e0a2-36fe-4faa-bbf0-d06f18bc68a6, 6656ae3d-8ae4-4082-a324-41f7306ce8ad, 679dfda9-58d9-492e-b421-730b7c3090ce, 6e0f85f8-7ac7-4c28-a54e-44d6af0bc75a, 762489c7-d4d4-4669-ba40-1d7150ab6bcd, 7d1c0808-99a0-43b0-a59c-69e297ee7b55, 843ba1c0-7c1f-4942-8964-a20a701ba1f5, 844e3ea0-47ab-4d29-b4cc-e5fca094ac58, 859e315f-a5ba-4b18-b923-fb30006e32d3, 8f865858-0c8e-4219-bd04-5de1d1e2143d, 90e8a833-081a-4577-9f8c-5e432b740515, 9246b1b3-3858-4a22-b88e-38da5ab8758c, 9270f852-e9f6-4cf6-908a-532130048d98, 92d6654e-8670-4ff6-8200-e6d7681bd2fa, 9f836434-f9dd-4e61-9d9a-dbb352532ff6, a7eea5e9-4dc8-4d3c-856e-09210549ddc8, aa49d101-dde8-49c8-892f-36ffedf4361c, adc369a4-8ac2-4e76-9f6c-ad7e8482a34a, b1eec916-7ac6-431f-b74b-d644d01118fd, b417d3c2-ac70-4456-a903-65375fe09313, b530bbf3-4fb3-427f-81a4-cde42ea044d0, c09d88f7-6e82-462f-93b7-27e733ed7008, c586635a-aea5-4474-ae87-1cb33a75f6fa, da1d74c4-2fac-4e27-80c6-6759adc290a6, de0ac47f-873a-4c50-b35a-ddda089de985, e108968c-6d76-4b08-8ad4-f1ec5ac4785b, e3205aed-dfb3-4d6b-b55d-8dc479f63fd5, e611e695-8df4-4c31-b37e-d04b4bfc9ccf, e6c8cdf4-feb8-4084-a9b4-4e7ddf862c84, ecc286fd-401a-4436-a659-10b7b00cef19, ef5bc0f4-6d28-46de-9323-102b1af263bd, ef8eb0f8-f0b1-405e-a777-1ba271616b65, f3b72180-cc03-47bb-885d-10687e10f23c, f5f5a34f-12e7-4d77-a6d4-1d8f20e411f5, fad5ec6e-5329-4df4-9a68-06a6d0567f5e, fb6c1c6f-4bba-4874-840c-5e2393f9f06d, fe360b7c-a729-453c-822e-53d53a8f6aee]","[1f809bc2b76afafa58be283bdd5598e9c7991720d3f7f51573700f77405e68c9945a5026b81455a4d2bd32022269e544d76c8559229c29e8cddddc5fbbc60a8b, 343807490b621d04e5c54d6e44f23f8598900b3d2f0ff28bb66003f2d684ce26aee9175772eb1f2bc3837c5d958614dc171a293a359556bc3413e4bcd1370698, 4f96d39c1ae02e36cd93f31311d2e1841673000974d3a86be96778e056da5f83fd58f7d6406e95c4d067bdc0f8a891f7a05e28ada3ab9d644dd2bd57f6714e4b, 806b8416bc1d468832dca9b1bafdf4d6efcff93fb45d318ba68c1f850b9912a7045e27a53d2881c27ecf2c96b04defcc6ece9dcc7709db56c1adfbe2b023fbfa, 8e0831997ca552741d789698bf3d1b2d3f72d51deca49960e529c1afbf35c88f6b9239b8a5d3f8c7dc27d3c40603dadae4a0f0751d0768a0197b232f44bd0401, 8f2a86401d459ef3825c003bbfc411d465917198de452929d1e55c638aa4f90c7bbfbca11f51d2ebeddd887b6a2810b22c03aea7acef90755d60a76b93144cd2, b1fd73f5d587dcecac6658d605c612c979ba2d99fa79429df34773c773272ed6b4a081b62d928905664aaf5f450d811d56f0fd05846618d83705a995863a6070, be6bc3b06eae92969625e91c687112d458f23217de77a8643461c8a97a5753a0226cc6b1aa5c813c333d1406423816bebeb7e5a143aae7aea8b5156614a4a078]",2025-10-10,52
02b16f7b-b728-4764-bb70-0d4e6f186e05,3,3,0,-1,"[55, 56, 57, 58, 59, 60]",Community 3,"[0713b85f-5696-4a4a-ad39-fc78077052b7, b5fd55b1-2e6b-4dea-9a9a-fc91fc692d56, c26cc304-d8c6-4198-a4a4-72b9f0489b1b, e9aa47ea-4fd0-408c-ab2e-fcf265cce2ef, 45aa430f-1d27-4d8b-964d-69169fefa20b, 1866f9d4-d772-4a0f-bded-025654b1a719, 62921632-e0c5-43a6-9497-4105ab824509, 929fe782-e9d3-4b37-a0f2-a17855b40c23, e295684c-5eef-4198-acda-1987da19315d, 260e9ddc-2cfb-428d-88e6-f5907f33fbf5, bc2afb2a-7e10-41f9-84dd-7eac5f13bd22, 6f2f61d2-7272-44ab-91df-c2ba77b4d30e, 9d9d874c-03c1-44f2-8b4d-d90be438149b, 1b51eb98-e504-4ece-b1cc-455774995fbd, cbeb8331-1aea-47b8-b91a-f00c40c850fe, b2fc6229-32b8-4bff-a0a1-5c72e070285f, bdc9b16d-79ee-4e99-8fe2-e7eae0163a35, b211eeaf-3f92-4d7f-b2dc-444e381a0ccd, 18a154de-f6a6-411b-b08d-74093d5ecc3e, 4579248a-05b4-4ab1-8591-628ba9e018b3, a9af0ddb-7b33-4411-9b49-b1ef7cc59fdf, aba5ce67-cce3-48fe-a15d-05438fb4d01d, 60678d92-2027-44c9-9516-4fa2ee68be0e, fa92207c-ed6b-438b-9548-50f898a0cd16, cb84b629-5954-4e52-a987-3b18b9338c2c, cad2a061-bae9-4c78-a033-d978c8196a79, 15cbdd40-9a45-468b-80c9-3d8e7685e97f, 17706d21-3e4c-4695-97bd-905fcee69e0f, 2dc2629c-3767-4287-af73-30aa4d268578, f6c1c427-ed5a-4135-a246-5bd1a055ebc4, 3c145aa8-d97b-4dd0-8d55-a1c974b0b2a6, 0aa7c6a7-b47a-49ab-9053-ff8c5d1dca36, a3854ec7-9af0-410e-a94c-4461bfda9dbd, aa14d9df-7d73-4118-885a-2f2ecf5c02e6, 874f3a13-4652-4e88-bdc5-261a39002c63, 97137369-9b76-4c3f-99de-4b12c1157dd7, 881144ca-a231-4425-9225-3f34dde5b73e, a1429764-568f-4ddc-973d-1e14fe3e13d0, 9fade451-42d2-464a-9b76-c800b9abe260, ddd63ac8-6de7-4a6a-9434-73d60540e8bd, cb53e3d7-e0d8-45bf-8bfb-0efab82fdf8d, 5e2f6f6b-fa39-4e45-81b9-31311186e4f1, 96928414-4acd-47a1-852d-77a1e674afd8, 32d280eb-1581-4be8-8296-8082beb547c0, 035a261f-e4d4-4af9-8f7a-792d89d331a3, 7793dbe8-6c81-476a-bc49-dfc1cf48a5e8, 77333c53-7352-41ec-9481-a31a73d2755e, 4c6bb435-ebe2-460b-9732-88134ab5e48e, abe9ef7e-de6f-4235-ac1d-206a6af11bb0, 72131209-afb4-4e7b-97cb-061f9f25339d, d2f8d6f5-22fc-4bbc-9fe7-82e06abbdad4, 7f07bcea-68e2-4f82-b6fb-28f37ebbe098]","[0674bd45-74c2-4cb4-a115-4b84422ee4e5, 08c8ed09-246f-4012-9c96-03de9f2273dc, 09749f8d-0bd0-4d38-ab20-96944e88e462, 0ba1a137-3dbd-4e5d-92bd-065b7494568b, 0f6fac45-8057-413b-b243-5e8cacd1d285, 167a2abe-1be5-4c9f-8ab6-fbf19210203a, 1b73b36d-b71b-476d-8759-75bb0bacb42d, 218f9f2c-204d-4ae8-b566-69c0b048a758, 2c79a8c3-0404-4f6a-8e7e-b988aad3263e, 2d15c73c-c106-4967-8245-4d552ca7ae58, 32d25ab8-d00f-4549-8f26-7d7acfe3e6c3, 37f55243-3281-4c13-abde-4e1df15d146c, 38016b12-8139-4f50-86b3-8e5694d497e4, 39d56b12-fcce-414a-87ef-80c96a0e4485, 3a1809c6-b27f-4864-a11b-ee230ce5a78a, 3bc286d7-2ac9-4b50-8902-5a397142c2eb, 3dbfed0d-0b20-4b7c-aacf-e017a9417449, 4091083f-319e-4622-ba12-8b7c5f99b777, 4463ef0d-4f2b-4ff2-b3fa-c7c90d091650, 498c59c4-4a05-421f-9b79-062aadd908f7, 4fb6c7ed-b19b-4a06-91f8-f82348af5c47, 517b3022-60f2-42fe-aacb-97d380b4fcac, 5367088c-8949-468d-a33e-80f8dab508f2, 612e1252-5783-4c3f-b221-bd65dae339b3, 6991a446-4fa8-4283-a419-5f53f2ac1a71, 6bad9def-e2c3-44b7-a6be-c24b62e459e8, 78ffe993-d275-4158-acdb-43d5f449627d, 7aa87ac8-93db-485a-aa5c-e6c09ada4d77, 7b792e5f-5ceb-4e05-9cf1-92043c9291c3, 8333c8b6-921d-4e21-b2c9-fd1a15d2ff3d, 85ac2dda-d903-4d1b-be3f-18572ae8e485, 89b30345-de57-4ae9-afc5-a2123a9a5411, 8f65533e-dd34-4efa-ad6c-98cb093d7c8c, 93ba433b-f3b7-4955-93c5-99af64d22aa5, 940e9c1b-212a-42be-bb5f-e02392f15b94, 9c9f99bc-2804-4d70-91a1-1c3e6c49ea61, a33b9bcd-01e3-49d4-ba08-09b3e5b76124, a494e0b9-c97e-4773-b733-6446153de2ea, a6295ac0-095d-436e-a4d1-1f04853fe9b9, ade8595c-409b-4387-a112-e20204463772, afda6f30-bbaf-4d76-91f7-34b8fa7db7e2, b4e232f6-c30a-46cc-a141-07ecb2408fcb, b8c96126-bcaa-479b-a720-a4bc309d7f5a, bf266a38-d093-4d8d-8998-c6181d21e717, bfb07719-6f74-4997-8db8-9164f2e75fba, c16de27c-e25a-41f7-bc63-3da20a62385e, c278612a-067b-493b-b4fd-1cc0aef8ebce, c27d928b-148e-4249-88a1-361aa6b16449, c569766a-8252-4432-a173-ed60d041896e, c9766d4c-b171-41bf-accc-1f1311b2f8be, ca5bf317-1b67-4642-96dc-7739de910474, cb688b09-2af0-4996-9396-194c6165092f, cfcb4441-d048-4d2e-985a-a4aab4901485, d0779647-ffe6-4775-8788-d89925d59c7e, d09b7a39-155c-412d-bb18-2d4e8ae6d21a, d11847e0-17c6-4daa-87d2-369d6a7ee809, d17b0b37-84d5-47d9-ac6d-eeb96efa7c27, d50158ab-6d15-40a7-a55e-5c00c16980fc, db5deeed-2fd8-4b65-89c2-53b1a725cdf7, dd041ccb-5a85-49eb-b36e-1a866db0335f, dde6a25e-0b64-41a1-9805-c6fd79490b13, def63eff-aa6c-4e4c-939f-eee6bab718e6, e1ab7ee9-b2d5-434d-a0df-55101c13d950, e30ca449-bb9b-4e65-9974-bfd8ea4494c6, e50dc6d7-a805-449a-9e0a-8d31e1d12070, e6c77058-b2a7-42f5-b008-1a18dfc9a30e, e9352214-f931-4176-a10c-10b444a8d5c0, ec386f80-ee79-4c7a-ba3f-486500a2d612, ecab7459-dac0-4138-884e-b72faee14470, f1728f42-0598-41b6-8b29-6ac2f3383da5, f787f6dd-b2d2-4151-b7a5-04531e13b423]","[08949556dc41ac148ae7fb8e92e785b55a6a22d8dceab1b9952d849fb05131def15317dd3171ba67d48cb75854d45329cf04385887993102024971b5bcbaf3c9, 1c32c20b1753f284c11e806c592f9c5e5166d6ce6a8217f03b368d16b95a45dcc0a56ec1306e44d0554f9d83dd2bbdeb89a986641b6b5e802c99001d1de93078, 686c2502be89fede5b418ff6ce39b13d1a35edf9906732bd576187b4334714f8a39c2ac112994a66e83a0f9599b99af5de1f006745c079569d0323addf903b3b, ad6b6ddd3259c940235728e6ade32a00a1d124cc673224550b4919e3c73f69d068ffa86975872a19241a0c11e2b2b2e38bea38f22d6cf3d7f6584d0b8f4e4b89, b1fd73f5d587dcecac6658d605c612c979ba2d99fa79429df34773c773272ed6b4a081b62d928905664aaf5f450d811d56f0fd05846618d83705a995863a6070, f929eb987a0515992a6822dccb8a91d516f8711cd78d515e14180213d4cb38f6ff56594b7ce9f9d52393a94a69875dc1b5a5c292178713e96786bf0f7cfa86bf, fcd20e6478cb21252e55819e879f230b77439a5e558abe106c82c7095a81c3b3526234f5c0863c2be4f17d5cc2787b68d98fa0bf9ba708731f1e1b6e231b690d]",2025-10-10,52
5d56e57f-7b3d-49fe-aaae-5cae94163cb2,4,4,0,-1,"[61, 62, 63, 64, 65, 66]",Community 4,"[5e157705-ff7f-47e5-8a35-f0d31edd1375, 2ef191ff-34a5-4991-b057-0fa18f0a9d07, 68bf3faa-4889-4f78-8b96-711cbf4a51d9, 05a5d40b-942c-4fd0-8400-70395bdc209c, 47fae1a9-5bf2-4078-b2ca-41f978f5466d, 57d07bbd-dafc-433b-ad87-36f8df74d5c5, 5b550126-a35d-4624-9c93-9e6eb782f143, 6a6c1565-9005-4e9e-9458-f57586a9f535, 167dc834-fe0b-445e-a83c-65c31908c72b, ae3e8319-3887-4bb7-817d-f4f56551ae13, 4e80c3df-ca26-45cb-9788-cc1c82220325, 1172439d-8d76-4cde-9aba-5a3ea81e8317, d93c7729-c25d-4d67-bbd2-01e0616eb36e, 8f9f2185-a340-48e2-80ef-3732ca83f82a, ab48cab3-b607-4b6b-8a90-39518cbdfa44, e71367eb-32a7-4776-8ff2-3b766e6fab42, 90dada4a-1e7e-4ff6-b3a6-5a72ade6d732, 33e43ce9-deb6-4737-b85c-d325958349e3, c8549113-de45-4d28-b9fc-98da42bb1e00, 10f27f38-cbbf-41ff-9bf5-e8d2f0c5c8d3, c6742f34-7606-4c50-a3db-c10edbd928ef, 6066051f-14f9-4d23-a057-26bf13b125c2, 363c8a4a-f67a-4b1c-93be-cb4fda3bb7f8, c27a9349-cd64-4a21-861a-cc0ffbb1f356, 0da4be5b-d9d3-44c0-9878-48d3e9fb0c34, 17414cfb-cd44-414a-949b-d58eecfa9619, e59b8fc2-3eff-4af5-a836-a83fbd6e64f2, d321ce16-ed91-4a3d-ad00-e0387c3758d0, 70927ed8-b7c1-466d-a1ab-78515fabc5f2, ca7c8ec6-e2c5-4968-ba6f-f1bc2939e856, bba19ad0-cf2f-451e-bc49-890cf05c29ff]","[00099598-9b9d-4c9c-a134-b766f4294c48, 07d3a8ff-0f0e-443c-9fa8-8215e388571f, 0aebcb7f-e796-4466-9475-5e121ca01590, 0bd32fae-b1d6-4729-b977-fd4fabd59680, 10d0edec-d1b3-4b3c-99e9-9dbf80b73f5a, 13cd8307-cd10-4d8a-8a78-912033a05812, 14bcdf7c-39d0-434d-b6e6-8729fd027707, 6214e3b0-08ce-4bc7-8109-6c2eda6de18d, 69ee26c0-25eb-4a95-9ed4-8d929de22933, 786aebf6-e6c1-4c0f-b4b9-8ff0aaca3c5c, 7a721ef2-4e68-4c55-a699-8513f9ad983e, 7bc1802f-eea2-4dd7-9087-7130244f1734, 8873f2e0-caa1-4df9-87bb-82d392cd9cdf, 8ed5a599-f0ce-4c6d-a87f-4e6ed37b2fb8, 91ad795b-9ea9-4335-9a45-318a2f30fd5f, 9da2ff2b-bd60-4ed9-a900-7bd9687b4360, a918d743-cc5d-4075-93fb-94bdd5cfbae4, bafd790a-a1c7-4e79-a303-4ab6e9c58a82, bcfbb70e-4620-409e-8389-c43f2209f27b, be8ac2b6-5c18-4f27-9394-4fb7e3225f0c, c1856b44-b5ed-45a2-a0ff-bb20b8e5b8c0, c3013201-f091-4314-9496-0bbe7adb0a92, c4056370-2e2f-4a42-a2e8-2ffc4a8dc992, ce0077fd-4cec-4743-81f6-4e749edf86ec, d04c4109-6d71-4747-b243-037ea42fca45, d097d9ec-8539-48f3-a772-3eaf3164e724, d0ac6c8e-3cc9-4480-a58c-c35bfb6c427a, d6cefc84-6d86-48ca-b1a4-5ab6c1a3801b, d9070adc-b68e-43b4-9d66-afef6e56768b, d92b0083-88dd-494a-8e50-8c53365d5ffa, dbc0bcd0-aa33-4a7f-a713-d3a55c7732ac, dca6706e-40a4-4b37-9e4a-9e661aba8647, e05096b3-821c-42b0-9d98-34a9ea45fcea, ea1cc3e0-4d2c-4b9b-8455-0b8ce0ded0aa, ef53aabd-8cbc-436d-8548-12b549d73ae8, f86c0726-73a0-4a4c-b3a8-8456b6bf7a8f, fe098cc9-f131-42cb-ad1f-b195149aff6c]","[162d9006cf669894096cb23701bcea32c23a38c8a9333f7142504da244de889211cd0d617bc6cbf82ff5ee8043d070073429f60ac88b413e90713c54626ed7e0, 1f5f82c9fb9b884c7a91241a9d320176dcde6b75f7966a1aedd911fd171cdcaa5ad3ccac49dc109fa54378f873afd216341b5c640211ad6d6966628412d99704, 9308a4166ccd245a6ae0c9830a807ccc894e483ed6b5c7da958fd59260273deac88f0f4a7ab6a2f2e36d3f2aa34871a76de64fa86c24b14b874300f666eb403e]",2025-10-10,31
813ffc2d-ff4e-4dd8-89db-63710558d3f5,5,5,0,-1,[],Community 5,"[b26127c2-392d-4869-8cfc-e88d1e927584, 8ef13adc-2ab6-465b-9256-5fe9b9dc1542, 46971807-bf88-4dcd-a8ee-3eb68fbf6dfb, 322f2740-86da-433d-ad17-9423d9c919bb, e4012885-c8ea-48e7-b45a-f1f201dc5909, 4593256c-b501-4c51-8f5d-c15eeff41a2f, 2e1a3ef4-e8a9-47c9-a9be-d7921bb61fdf, cf50f5dd-0086-4b69-8f55-d51d39b20d4d, f4ce7382-62c6-472d-8ca4-8543a9cc5663]","[029d66c9-2aa6-42b9-be93-25cd842f2042, 02f6a459-bb38-404d-8e7d-a66fc0d879b7, 12e3a075-8527-4982-a8c7-e18d5cceb5c9, 177ae06b-a0b6-4e0a-8880-2cec5097464b, 3cd9e973-0113-484d-bc4c-c46684f8d179, 41a2b4fb-6edf-4a16-bd98-7ea28a1b7126, 5c8bda9f-3b62-44c4-b4f2-b1e49d1f8fb9, 6dc4b401-326c-4a89-a8bb-00598803666f, e8bfc8e1-1f19-4847-9481-983c9a48cecb]",[b716926ba38e5845bb998ad969f2c5cd4ca56730dbfcfb98aea5cce442d869c55288b25f05096ce3a2d2f83f1f9ac857a137a24d92b1f9e8edaf588783dd54fa],2025-10-10,9
804667df-25a5-4659-99a8-a557a8126006,6,6,0,-1,"[67, 68, 69]",Community 6,"[16faf84e-73ca-4875-aa79-752ca24131d1, 38c302ce-177b-4513-b57e-cfb8bd62dc48, 8e78b788-748c-4192-a911-38d5352f8e8e, b01fa03a-acd4-429b-a1ef-51f294560fef, b7d796fe-a713-4449-821f-341146da387e, 3baf1cd8-1d36-44f9-a725-34c0945d1397, 177b8198-ca39-41bc-9dd8-dd29031fbcf1, 3f8ecc55-e6f2-4134-a35d-d5cecd376e1f, 15b4cff7-dbd8-42cc-beb0-28c76c7bdc39, 5dbb380a-0c7d-46c5-adc2-de9870dba44b, a94d0479-a83e-4311-9e49-7b3bc3346437, 31baf388-9a22-4dc7-9825-437c5865e46f, 7ae79ebe-d9db-468e-8f30-d04c3beb2f7c, 2130f23a-4e41-49c2-a108-8fe21fbc8992, 67bb5bd8-b0d7-4bdd-a087-fc70ad74b2b5, 86c229d2-e2f6-46b8-86e8-9232e1a4bf7b, 817df086-7d25-47f1-9b5e-d5518a9b9dd7, 073d1a7e-a465-496c-bb05-d855cb2c1188, 3e5a4ef6-41e5-4145-9dc0-3a6a6ed6866c, 5fe1e760-5278-4169-889c-39110685be13, 9d501d15-484c-4ea9-b99c-24744ac9d47a, 8ae91fbf-3a8d-4110-8d09-a90abb97ef25, 124c4481-be99-411d-bab0-becd1743fd5a, e72405f7-8296-4c95-83dd-2127b19006c3, 335857df-8336-4ea2-89b7-a5b0983c295e, d0b2673d-d01e-4d09-9b0d-035b1e759d92]","[0026b3c1-5522-4333-948e-82df3ba9bdd5, 07af4e4c-c2c6-41be-8021-d2ba26f185b9, 14f7393e-ed3d-43b6-9e28-8f1a8b2262c6, 1e414965-9e6a-4ae0-82d9-663dd0899c10, 245678c3-a94b-4171-8613-0c7336db5d83, 2dda4bc0-8a14-49b2-914e-8c587561ef8d, 450614d1-0f36-4822-ae41-f0b80f4a1a1e, 46d474bd-aef3-4eec-be54-d657196e81aa, 4b0dfa3d-a69b-4f46-9d3c-6efc16efb712, 4b6fd719-738b-4e55-9474-64fcca6a86ca, 5102192a-9522-4f3a-9b63-97855be825fb, 518c556a-9a4d-4577-83d6-f29d8288d657, 5a544337-24e8-4f9b-9918-642762693b17, 61d374b9-2d33-45ae-bb67-bb60874dbdb5, 64890e38-252a-486b-b045-4fed8e34426d, 6c03e994-e5af-432f-92e7-cc3943584dc2, 71d22367-4efd-44d4-b83c-c1f5f050b01b, 868d9880-454d-43e3-b086-1a21272abeca, 8b574e01-335b-440a-9d71-1622ae42d24e, 92093a95-3d70-4b55-b7bb-9fd0d96e005d, a1c18301-91d1-40e3-b9a1-2a3bea553936, a5ae1e2e-7b03-4ac9-8cda-aec6d0c9e62d, acb7eafc-eb2e-4532-bf89-fc55bf518efc, ade15963-8fd2-4b63-a8e2-3d1455d01521, b6f781fa-bc07-4ef2-b9f6-8bbba3e442c8, d5da7fad-8855-402f-90b0-8e36cb6305a8, db494a61-1481-4aea-89ad-c32d6f7862b3, e40fb03d-3a24-4661-a076-7ab129b6a5b3, e447d404-a14f-4b86-a3d8-147343d81847, e668f972-9a69-464c-a3a0-fc590c84e4cd, f0044d05-597f-4d76-af7a-a3eba552aaeb, f439106d-939f-422a-a6f0-f14e32d4198f, faae2a0d-675d-4b4d-897d-822457effdc1, ff4be4ef-0cbd-4d38-9581-e59687788ebb]","[114fd06a285e27d407527ea0eea99afe0f8bf93aa822c0eb89f3a6a0dc1a39f285f4516360d65820a65f460fe0a3b13d9c458031072d8316a445557ec8daaead, 2afc63dc1a69c70d2c9ecd7c9fcb5da1979ab4d04b1183ad87a81e628a2237e38ce8342f52fb14ee456b00d27fe42beb7804b0b94dbf11bfde916992d05aeae9, b0a74f48203530c24a1b3adc88acb4955998bf6549e69348143b19fd86e27b7d54e119b88cde28f12cfe596af906497c53531713a2e6e543bad700d232cf53fc]",2025-10-10,26
